{
  "schema_version": "0.1",
  "graph_id": "legacy-sokrat-to-socrates-v0.1",
  "project_id": "FATHER",
  "created_at": "2026-08-08T01:00:00+03:00",
  "nodes": [
    {"id":"goal-001","type":"Goal","title":"Получать более проверяемые инженерные решения","status":"ACCEPTED","version":"0.1","confidence":1.0,"classification":"internal","created_at":"2026-08-08T01:00:00+03:00","updated_at":null,"created_by":"human+assistant","source_of_truth":"DEVELOPMENT_LOG.md","attributes":{}},
    {"id":"problem-001","type":"Problem","title":"Один LLM-ответ не даёт достаточной проверки альтернатив и разногласий","status":"SUPPORTED","version":"0.1","confidence":0.9,"classification":"internal","created_at":"2026-08-08T01:00:00+03:00","updated_at":null,"created_by":"human+assistant","source_of_truth":"legacy-analysis","attributes":{}},
    {"id":"source-001","type":"Source","title":"VictorKVS/Sokrat research_engine/core/orchestrator.py","status":"VERIFIED","version":"legacy","confidence":1.0,"classification":"public-repository","created_at":"2026-08-08T01:00:00+03:00","updated_at":null,"created_by":"repository-analysis","source_of_truth":"GitHub","attributes":{"repository":"VictorKVS/Sokrat","path":"research_engine/core/orchestrator.py"}},
    {"id":"evidence-001","type":"Evidence","title":"Sokrat реализует primary response, expert reviews, discussion round, judge и quality score","status":"VERIFIED","version":"0.1","confidence":1.0,"classification":"internal","created_at":"2026-08-08T01:00:00+03:00","updated_at":null,"created_by":"repository-analysis","source_of_truth":"source-001","attributes":{}},
    {"id":"capability-001","type":"Capability","title":"Multi-expert decision deliberation","status":"ADAPT","version":"0.1","confidence":0.95,"classification":"internal","created_at":"2026-08-08T01:00:00+03:00","updated_at":null,"created_by":"legacy-intelligence","source_of_truth":"LEGACY-002","attributes":{"legacy_origin":"Sokrat"}},
    {"id":"alternative-001","type":"Alternative","title":"Оставить Sokrat как always-on multi-model council","status":"REJECTED_FOR_MVP","version":"0.1","confidence":0.8,"classification":"internal","created_at":"2026-08-08T01:00:00+03:00","updated_at":null,"created_by":"architecture","source_of_truth":"DEV-0002","attributes":{"reason":"cost and provider coupling"}},
    {"id":"alternative-002","type":"Alternative","title":"Переработать Sokrat в role-based SOCRATES-lite","status":"SELECTED","version":"0.1","confidence":0.95,"classification":"internal","created_at":"2026-08-08T01:00:00+03:00","updated_at":null,"created_by":"architecture","source_of_truth":"DEV-0002","attributes":{}},
    {"id":"decision-001","type":"Decision","title":"Восстановить Sokrat как SOCRATES Decision Engine с независимыми экспертными ролями","status":"ACCEPTED","version":"0.1","confidence":0.95,"classification":"internal","created_at":"2026-08-08T01:00:00+03:00","updated_at":null,"created_by":"human+assistant","source_of_truth":"DEV-0002","attributes":{}},
    {"id":"component-001","type":"Component","title":"SOCRATES-lite","status":"PLANNED","version":"0.1","confidence":0.9,"classification":"internal","created_at":"2026-08-08T01:00:00+03:00","updated_at":null,"created_by":"architecture","source_of_truth":"WORK_PLAN.md","attributes":{}},
    {"id":"metric-001","type":"Metric","title":"Decision trace completeness","status":"PLANNED","version":"0.1","confidence":0.8,"classification":"internal","created_at":"2026-08-08T01:00:00+03:00","updated_at":null,"created_by":"architecture","source_of_truth":"SOCRATES-plan","attributes":{"target":">=0.9"}},
    {"id":"outcome-001","type":"Outcome","title":"Фактическое качество SOCRATES-lite","status":"PENDING","version":"0.1","confidence":null,"classification":"internal","created_at":"2026-08-08T01:00:00+03:00","updated_at":null,"created_by":"system","source_of_truth":"future-test","attributes":{}}
  ],
  "edges": [
    {"id":"e-001","source_node":"problem-001","relation_type":"PROBLEM_BLOCKS_GOAL","target_node":"goal-001","status":"SUPPORTED","confidence":0.9,"evidence_ref":"evidence-001","influence_direction":"negative","influence_strength":0.7,"causality_status":"hypothesized","created_at":"2026-08-08T01:00:00+03:00","attributes":{}},
    {"id":"e-002","source_node":"source-001","relation_type":"SOURCE_CONTAINS_EVIDENCE","target_node":"evidence-001","status":"VERIFIED","confidence":1.0,"evidence_ref":null,"influence_direction":null,"influence_strength":null,"causality_status":"observed","created_at":"2026-08-08T01:00:00+03:00","attributes":{}},
    {"id":"e-003","source_node":"evidence-001","relation_type":"EVIDENCE_SUPPORTS_CLAIM","target_node":"capability-001","status":"VERIFIED","confidence":0.95,"evidence_ref":"evidence-001","influence_direction":"positive","influence_strength":0.8,"causality_status":"observed","created_at":"2026-08-08T01:00:00+03:00","attributes":{}},
    {"id":"e-004","source_node":"decision-001","relation_type":"DECISION_SELECTS","target_node":"alternative-002","status":"ACCEPTED","confidence":1.0,"evidence_ref":"evidence-001","influence_direction":"positive","influence_strength":0.9,"causality_status":"hypothesized","created_at":"2026-08-08T01:00:00+03:00","attributes":{}},
    {"id":"e-005","source_node":"decision-001","relation_type":"DECISION_REJECTS","target_node":"alternative-001","status":"ACCEPTED","confidence":1.0,"evidence_ref":null,"influence_direction":"negative","influence_strength":0.7,"causality_status":"hypothesized","created_at":"2026-08-08T01:00:00+03:00","attributes":{}},
    {"id":"e-006","source_node":"decision-001","relation_type":"DECISION_RESOLVES_PROBLEM","target_node":"problem-001","status":"PLANNED","confidence":0.8,"evidence_ref":null,"influence_direction":"positive","influence_strength":0.8,"causality_status":"hypothesized","created_at":"2026-08-08T01:00:00+03:00","attributes":{}},
    {"id":"e-007","source_node":"component-001","relation_type":"COMPONENT_REALIZES_CAPABILITY","target_node":"capability-001","status":"PLANNED","confidence":0.9,"evidence_ref":null,"influence_direction":"positive","influence_strength":0.9,"causality_status":"hypothesized","created_at":"2026-08-08T01:00:00+03:00","attributes":{}},
    {"id":"e-008","source_node":"decision-001","relation_type":"DECISION_EXPECTS_OUTCOME","target_node":"outcome-001","status":"PLANNED","confidence":0.8,"evidence_ref":null,"influence_direction":"positive","influence_strength":0.8,"causality_status":"hypothesized","created_at":"2026-08-08T01:00:00+03:00","attributes":{}},
    {"id":"e-009","source_node":"outcome-001","relation_type":"OUTCOME_MEASURED_BY","target_node":"metric-001","status":"PLANNED","confidence":0.8,"evidence_ref":null,"influence_direction":"unknown","influence_strength":null,"causality_status":"hypothesized","created_at":"2026-08-08T01:00:00+03:00","attributes":{}}
  ]
}
